section_name	web_url	pub_date	snippet
World	https://www.nytimes.com/aponline/2017/07/08/world/europe/ap-eu-russia-us.html	2017-07-08T16:01:10+0000	Russian President Vladimir Putin hailed his first face-to-face meeting with U.S. President Donald Trump, saying Saturday he thinks Trump accepted his assurances that Russia didn't meddle in the U.S. presidential election and that their conversatio...
World	https://www.nytimes.com/aponline/2017/07/08/world/africa/ap-af-congo-elections.html	2017-07-08T15:51:55+0000	The head of Congo's electoral commission says it is not possible to organize presidential elections by the end of this year. The move goes against a political agreement with the opposition, which has accused President Joseph Kabila of clinging to ...
World	https://www.nytimes.com/reuters/2017/07/08/world/europe/08reuters-g20-germany-usa-china-ties.html	2017-07-08T15:51:27+0000	Chinese President Xi Jinping urged joint efforts to keep Sino-U.S. ties on track during a meeting with President Donald Trump on Saturday on the sidelines of the G20 summit in the German city of Hamburg, state news agency Xinhua said....
Business Day	https://www.nytimes.com/reuters/2017/07/08/business/08reuters-g20-germany-britain.html	2017-07-08T15:48:29+0000	Leaders from several members of the Group of 20 economic powers expressed a "strong desire" to forge "ambitious new bilateral trading relationships" with Britain after it leaves the European Union, British Prime Minister Theresa May said on Saturd...
World	https://www.nytimes.com/reuters/2017/07/08/world/middleeast/08reuters-lebanon-refugees-syria-judge.html	2017-07-08T15:45:34+0000	A Lebanese military prosecutor ordered forensics to examine the bodies of four Syrians who died in army custody last week following calls for an inquiry by rights groups, a judge said on Saturday....
World	https://www.nytimes.com/2017/07/08/world/europe/protests-hamburg-germany-group-of-20.html	2017-07-08T15:45:12+0000	Organizers of the main march said about 76,000 people were taking part, and tens of thousands of police officers were mobilized to keep watch....
Business Day	https://www.nytimes.com/reuters/2017/07/08/business/08reuters-ukraine-crisis-crimea-power-commissioning-exclusive.html	2017-07-08T15:36:29+0000	A firm part-owned by Germany's Siemens has been hired to help install electricity turbines in Crimea, a region subject to European Union sanctions barring EU firms from supplying it with energy technology, three sources close to the project told R...
Business Day	https://www.nytimes.com/reuters/2017/07/08/business/08reuters-g20-germany-steel.html	2017-07-08T15:30:33+0000	German Chancellor Angela Merkel said it was important to stick to aggressive deadlines for addressing overcapacities in the global steel market, or the United States could resort to unilateral action by imposing fines or tariffs....
World	https://www.nytimes.com/2017/07/08/world/europe/grenfell-fire-london-ladder.html	2017-07-08T15:29:41+0000	The London Fire Brigade’s high ladder reached only to Grenfell Tower’s 10th floor and was called to the scene nearly half an hour after other units, a fire official said....
Business Day	https://www.nytimes.com/reuters/2017/07/08/business/08reuters-g20-germany-putin-gas.html	2017-07-08T15:27:34+0000	Russian gas has a competitive advantage over liquefied natural gas (LNG) exports from the United States to Europe due to lower production and transportation costs, Russian President Vladimir Putin told reporters on Saturday....
World	https://www.nytimes.com/aponline/2017/07/08/world/europe/ap-eu-poland-walesa-hospitalized.html	2017-07-08T15:24:48+0000	Poland's former president Lech Walesa, a democracy hero, has been hospitalized with heart problems in his Baltic coast home city of Gdansk, his son said Saturday....
World	https://www.nytimes.com/reuters/2017/07/08/world/europe/08reuters-g20-germany-rights-turkey.html	2017-07-08T15:24:30+0000	The head of Amnesty International urged world leaders on Saturday to stand up to "hyper-nationalist" democratically elected leaders in countries including Turkey, where authorities have detained the local director and chair of the rights group....
World	https://www.nytimes.com/aponline/2017/07/08/world/africa/ap-af-africa-us-hunger-aid.html	2017-07-08T15:15:53+0000	The United States on Saturday announced more than $630 million in aid for Yemen, Somalia, South Sudan and Nigeria, where conflict has helped to cause what the United Nations calls the world's largest humanitarian crisis in more than 70 years....
World	https://www.nytimes.com/reuters/2017/07/08/world/europe/08reuters-g20-germany-putin-usa-ukraine.html	2017-07-08T15:15:35+0000	President Vladimir Putin said on Saturday Russia welcomed the United States appointing a new envoy to try to solve the Ukraine crisis....
World	https://www.nytimes.com/2017/07/08/world/americas/venezuela-leopoldo-lopez-political-prisoner.html	2017-07-08T15:13:44+0000	The surprise release of the opposition leader came after years of political negotiations....
World	https://www.nytimes.com/aponline/2017/07/08/world/americas/ap-tropical-weather.html	2017-07-08T15:04:04+0000	An intensifying Eugene grew into a hurricane Saturday night in the Pacific Ocean off Mexico but the storm was not expected to threaten land....
World	https://www.nytimes.com/reuters/2017/07/08/world/middleeast/08reuters-egypt-security-sinai.html	2017-07-08T15:00:32+0000	Egypt's Interior Ministry said on Saturday its forces had killed 14 gunmen in Ismalia province, adding that they were linked to recent attacks against the security forces in Northern Sinai....
World	https://www.nytimes.com/reuters/2017/07/08/world/europe/08reuters-g20-germany-russia-meddling.html	2017-07-08T14:57:27+0000	Russian President Vladimir Putin said on Saturday that Russia will not interfere in parliamentary elections in Germany that are due to be held in September, adding that Moscow and Berlin have "good relations"....
World	https://www.nytimes.com/reuters/2017/07/08/world/europe/08reuters-g20-germany-merkel-turkey.html	2017-07-08T14:54:36+0000	German Chancellor Angela Merkel said on Saturday that her bilateral meeting with Turkish President Tayyip Erdogan revealed deep differences between the two NATO allies....
World	https://www.nytimes.com/reuters/2017/07/08/world/europe/08reuters-g20-germany-merkel-trump-putin.html	2017-07-08T14:54:33+0000	German Chancellor Angela Merkel said on Saturday that she was pleased U.S. President Donald Trump and Russia's Vladimir Putin had finally met and expressed hope that the dialogue between the two leaders would continue....
World	https://www.nytimes.com/reuters/2017/07/08/world/europe/08reuters-g20-germany-putin-improvement.html	2017-07-08T14:51:29+0000	Russian President Vladimir Putin said on Saturday after his first meeting with U.S. President Donald Trump that certain pre-cursors had been created for an improvement in relations between Moscow and Washington....
World	https://www.nytimes.com/reuters/2017/07/08/world/europe/08reuters-g20-germany-putin-syria.html	2017-07-08T14:48:32+0000	Russian President Vladimir Putin said on Saturday that a new ceasefire deal in southern Syria was the result of the United States altering its stance and becoming more pragmatic about the situation there....
World	https://www.nytimes.com/2017/07/08/world/asia/afghanistan-women-honor-killings.html	2017-07-08T14:45:59+0000	If Afghanistan is one of the worst places to be a woman, then Ghor Province may be the country’s capital of gender-based violence....
World	https://www.nytimes.com/reuters/2017/07/08/world/europe/08reuters-g20-germany-climatechange-macron.html	2017-07-08T14:39:29+0000	French President Emmanuel Macron said on Saturday he had not given up on trying to get U.S. counterpart Donald Trump to change his mind about withdrawing the United States from the Paris climate change agreement....
World	https://www.nytimes.com/aponline/2017/07/08/world/africa/ap-af-south-sudan-rebel-stronghold.html	2017-07-08T14:37:03+0000	Thousands of South Sudanese have been displaced and aid workers evacuated as rebels on Saturday accused government troops of advancing on their stronghold and killing civilians along the way....
World	https://www.nytimes.com/reuters/2017/07/08/world/europe/08reuters-g20-germany-putin-trump-meddling.html	2017-07-08T14:36:32+0000	President Vladimir Putin said on Saturday Donald Trump, his U.S. counterpart, had asked him detailed questions regarding allegations that Moscow had interfered in last year's U.S. election....
World	https://www.nytimes.com/reuters/2017/07/08/world/europe/08reuters-g20-germany-putin-trump.html	2017-07-08T14:36:30+0000	President Vladimir Putin said on Saturday he thought his U.S. counterpart Donald Trump had been satisfied with his assertions that Russia had not meddled in the U.S. presidential election....
World	https://www.nytimes.com/reuters/2017/07/08/world/asia/08reuters-g20-germany-trump-xi.html	2017-07-08T14:33:28+0000	U.S. President Donald Trump took a conciliatory tone on Saturday at a meeting with Chinese President Xi Jinping where the leaders agreed to keep working on two pressing issues: the nuclear threat posed by North Korea and bilateral trade irritants....
Business Day	https://www.nytimes.com/reuters/2017/07/08/business/08reuters-g20-germany-merkel.html	2017-07-08T14:21:32+0000	German Chancellor Angela Merkel said on Saturday she was pleased that all Group of 20 members besides the United States had agreed in a communique that the Paris climate accord was irreversible....
World	https://www.nytimes.com/2017/07/08/world/americas/cuba-trump-extradition-hijacker-assata-shakur.html	2017-07-08T14:19:21+0000	For more than 30 years, Ishmael Muslim Ali has lived in Cuba. But President Trump is calling for the extradition of convicts who claimed asylum there....
World	https://www.nytimes.com/reuters/2017/07/08/world/asia/08reuters-g20-germany-usa-china.html	2017-07-08T14:18:29+0000	China's navy will join will join next year's Pacific Rim military exercises, state news agency Xinhua quoted President Xi Jinping as saying on Saturday following his meeting with U.S. President Donald Trump on the sidelines of the G20 summit in th...
World	https://www.nytimes.com/2017/07/08/world/europe/vladimir-putin-russia-g20.html	2017-07-08T14:16:50+0000	There was relief that if short on concrete deals, the talks seemed to halt the downward spiral in relations and lack of contact between the two countries....
Business Day	https://www.nytimes.com/reuters/2017/07/08/business/08reuters-canada-eu-trade.html	2017-07-08T14:15:29+0000	The European Union and Canada said on Saturday they had agreed to start a free trade agreement on Sept. 21, paving the way for over 90 percent of the treaty to come into effect....
World	https://www.nytimes.com/aponline/2017/07/08/world/asia/ap-as-nkorea-land-of-lousy-options.html	2017-07-08T14:03:48+0000	A dictator stands on the verge of possessing nuclear missiles that threaten U.S. shores. A worried world ponders airstrikes and sanctions....
World	https://www.nytimes.com/reuters/2017/07/08/world/middleeast/08reuters-mideast-crisis-iraq-islamic-state.html	2017-07-08T14:03:29+0000	Islamic State fighters pledged on Saturday to fight to the death defending their last redoubt in the Old City of Mosul against U.S.-backed Iraqi forces, the group's news agency Amaq said....
World	https://www.nytimes.com/reuters/2017/07/08/world/middleeast/08reuters-gulf-qatar-johnson.html	2017-07-08T13:54:27+0000	British Foreign Secretary Boris Johnson said on Saturday progress could be made to heal a rift between Qatar and other Arab states, although a solution was unlikely to be found immediately....
World	https://www.nytimes.com/reuters/2017/07/08/world/middleeast/08reuters-egypt-security.html	2017-07-08T13:30:29+0000	Egyptian police officers have shot dead 16 gunmen in two shootouts, the country's Interior Ministry said on Saturday, adding that most of those killed were fugitive militants linked to recent attacks on security forces in Northern Sinai....
World	https://www.nytimes.com/aponline/2017/07/08/world/europe/ap-eu-trump-women-entrepreneurs-.html	2017-07-08T13:24:54+0000	President Donald Trump said Saturday the U.S. would contribute $50 million to a new World Bank fund conceived by his daughter that aims to help women entrepreneurs access capital and other support....
World	https://www.nytimes.com/reuters/2017/07/08/world/asia/08reuters-g20-germany-trump-abe.html	2017-07-08T13:24:31+0000	U.S. President Donald Trump and Japanese Prime Minister Shinzo Abe discussed North Korea's nuclear program on the sidelines of the G20 summit on Saturday....
World	https://www.nytimes.com/reuters/2017/07/08/world/europe/08reuters-europe-migrants-libya.html	2017-07-08T13:24:28+0000	Libyan coast guards rescued about 85 migrants off the shore east of Tripoli on Saturday but about 40 more migrants were believed to be missing, a coast guard officer said....
World	https://www.nytimes.com/reuters/2017/07/08/world/europe/08reuters-g20-germany-putin-u-s.html	2017-07-08T13:18:34+0000	Russian President Vladimir Putin has told leaders at the G20 summit that Russia has never interfered in the U.S. election, Russian G20 sherpa Svetlana Lukash said on Twitter on Saturday....
Business Day	https://www.nytimes.com/2017/07/08/business/retirement/lgbt-rights-retirement-communities.html	2017-07-08T13:03:29+0000	Older lesbian, gay, bisexual and transgender people face challenges finding retirement communities that will welcome them....
Business Day	https://www.nytimes.com/reuters/2017/07/08/business/08reuters-france-politics-assets-edf.html	2017-07-08T12:57:31+0000	French utility EDF would not be part of the French government's plan to sell 10 billion euros ($11.40 billion) worth of state assets to finance projects geared toward innovation, a source close to EDF's management said on Saturday....
World	https://www.nytimes.com/reuters/2017/07/08/world/europe/08reuters-g20-germany-famine.html	2017-07-08T12:54:29+0000	U.S. President Donald Trump on Saturday promised $639 million in aid to feed people left starving because of drought and conflict in Somalia, South Sudan, Nigeria and Yemen....
Business Day	https://www.nytimes.com/reuters/2017/07/08/business/08reuters-italy-amundi.html	2017-07-08T12:36:27+0000	Italian banks, long plagued by bad loans burdening their balance sheets are regaining health after authorities tackled several troubled lenders recently, the head of asset manager Amundi said on Saturday....
World	https://www.nytimes.com/aponline/2017/07/08/world/americas/ap-lt-venezuela-political-crisis.html	2017-07-08T12:21:39+0000	Opposition leader Leopoldo Lopez was released from prison and placed under house arrest Saturday after more than three years in a military lockup, a shock reversal by the government that fueled hopes for a broader amnesty for dozens of jailed acti...
World	https://www.nytimes.com/reuters/2017/07/08/world/europe/08reuters-g20-germany-france-russia.html	2017-07-08T12:09:30+0000	French President Emmanuel Macron said he told Russian counterpart Vladimir Putin the two countries had made a "tangible" progress in bilateral relations, which could move to a new phase....
Business Day	https://www.nytimes.com/reuters/2017/07/08/business/08reuters-britain-visa-hogg.html	2017-07-08T12:09:28+0000	Charlotte Hogg, who resigned as the Bank of England's deputy governor in March over concerns about a potential conflict of interest, is in talks to take over as chief executive at Visa Europe, Sky News reported on Saturday....
World	https://www.nytimes.com/reuters/2017/07/08/world/asia/08reuters-india-kashmir.html	2017-07-08T12:06:30+0000	Seven people were killed in Kashmir in cross-border shelling by both Pakistan and India on Saturday, officials on both sides of the frontier said, as the anniversary of a militant's killing raised tensions in the disputed region....
World	https://www.nytimes.com/reuters/2017/07/08/world/americas/08reuters-venezuela-politics-lopez.html	2017-07-08T12:00:29+0000	Venezuelan opposition leader Leopoldo Lopez on Saturday waved to a cheering crowd of supporters gathered outside him home following a Supreme Court decision to grant him house arrest, Reuters witnesses said....
World	https://www.nytimes.com/reuters/2017/07/08/world/americas/08reuters-venezuela-politics.html	2017-07-08T11:51:29+0000	Venezuela's best-known jailed opposition leader Leopoldo Lopez celebrated a surprise return to his family after being granted house arrest on Saturday with a promise to fight on following three years' imprisonment for leading anti-government prote...
World	https://www.nytimes.com/reuters/2017/07/08/world/middleeast/08reuters-mideast-crisis-syria-un.html	2017-07-08T11:48:29+0000	A ceasefire deal agreed for southwestern Syria is a positive development that could help prop up the political process aimed at ending the country's six-year war, the U.N. Deputy Special Envoy for Syria said on Saturday....
World	https://www.nytimes.com/aponline/2017/07/08/world/europe/ap-eu-poland-unesco-eritrea.html	2017-07-08T11:42:53+0000	Eritrean officials on Saturday claimed "victory" after the U.N. cultural agency unanimously decided to put the African nation's capital city of Asmara on the UNESCO World Heritage list &#8212; the result of years of lobbying by one of the world's ...
World	https://www.nytimes.com/reuters/2017/07/08/world/europe/08reuters-europe-attacks-muslims-march.html	2017-07-08T11:36:30+0000	Dozens of religious leaders boarded a bus on the Champs Elysees in Paris on Saturday to kick off a European tour of the sites of recent Islamist attacks to remember the victims and condemn violence.&#160;&#160;&#160; Imams from countries including...
Business Day	https://www.nytimes.com/reuters/2017/07/08/business/08reuters-indonesia-economy.html	2017-07-08T11:30:28+0000	Indonesian state firms are courting foreign pension funds by offering a share in future revenue from toll roads, power stations and other infrastructure projects, as part of a presidential drive to secure $10 billion (7.76 billion pounds) in addit...
World	https://www.nytimes.com/aponline/2017/07/08/world/europe/ap-eu-europe-migrants.html	2017-07-08T11:27:56+0000	A Cyprus police spokesman says 85 Syrian migrants who arrived by boat to the island's northwestern coast have now been taken to a reception center....
World	https://www.nytimes.com/reuters/2017/07/08/world/europe/08reuters-italy-chechnya-arrests.html	2017-07-08T11:18:33+0000	Italian police said on Saturday they had arrested a Chechen man suspected of being a militant of Islamic State and involvement in attacks in the Chechen capital Grozny in 2014....
World	https://www.nytimes.com/aponline/2017/07/08/world/middleeast/ap-ml-syria-.html	2017-07-08T11:09:46+0000	The United Nations on Saturday welcomed the agreement struck between the United States and Russia for a cease-fire in southwest Syria, saying it would support upcoming peace talks....
World	https://www.nytimes.com/reuters/2017/07/08/world/asia/08reuters-g20-germany-china-japan.html	2017-07-08T11:09:27+0000	Chinese President Xi Jinping urged Japanese Prime Minister Shinzo Abe on Saturday to put aside "distractions" that have strained bilateral ties and warned that China was unwilling to compromise on Taiwan, state news agency Xinhua said....
World	https://www.nytimes.com/aponline/2017/07/08/world/africa/ap-af-kenya-beheadings.html	2017-07-08T11:00:37+0000	Al-Shabab extremists from neighboring Somalia beheaded nine civilians in an attack on a village in Kenya's southeast early Saturday, officials said, adding to growing concerns the Islamic militant group has taken up a bloody new strategy....
World	https://www.nytimes.com/2017/07/08/world/asia/china-aircraft-carrier-liaoning-hong-kong.html	2017-07-08T10:55:56+0000	The visit, which coincides with the 20th anniversary of the former British colony’s return to China, is meant to signal the country’s growing military might....
Business Day	https://www.nytimes.com/reuters/2017/07/08/business/08reuters-germany-realestate-bundesbank.html	2017-07-08T10:54:29+0000	Cheap credit is for now not fuelling a destabilizing real-estate bubble in Germany but the central bank is closely watching the market, Bundesbank vice president Claudia Buch said on Saturday....
Business Day	https://www.nytimes.com/reuters/2017/07/08/business/08reuters-veolia-ceo-m-a.html	2017-07-08T10:48:29+0000	French utility Veolia has the financial firepower to make a multi-billion euro acquisition, its chief executive said on Saturday....
World	https://www.nytimes.com/2017/07/08/world/middleeast/isis-syria-iraq.html	2017-07-08T10:47:59+0000	The Islamic State’s territory-building project is crumbling, but it still has an international reach and an ideology that motivates attackers around the world....
World	https://www.nytimes.com/aponline/2017/07/08/world/europe/ap-eu-spain-acrobat-death.html	2017-07-08T10:36:37+0000	Event organizers say an acrobat fell to his death during a rock music festival in Madrid on Friday night....
World	https://www.nytimes.com/reuters/2017/07/08/world/middleeast/08reuters-mideast-crisis-iraq-mosul-refugees.html	2017-07-08T10:36:29+0000	Victory over Islamic State may be close at hand in the battle for Mosul but many of the almost one million city residents displaced by months of fighting are in no mood to celebrate....
World	https://www.nytimes.com/aponline/2017/07/08/world/middleeast/ap-ml-jordan-israel-syria-truce.html	2017-07-08T10:30:43+0000	A separate truce for southern Syria, brokered by the U.S. and Russia, is meant to help allay growing concerns by neighboring Jordan and Israel about Iranian military ambitions in the area, including fears that Tehran plans to set up a disruptive l...
World	https://www.nytimes.com/reuters/2017/07/08/world/africa/08reuters-kenya-attack.html	2017-07-08T10:18:36+0000	Suspected Islamist militants beheaded nine men in an overnight attack on a village in the Kenyan coastal district of Lamu, police said, days after Somali militants killed three policemen in an attack on a nearby village....
World	https://www.nytimes.com/reuters/2017/07/08/world/europe/08reuters-g20-germany-china-france.html	2017-07-08T10:12:31+0000	Chinese President Xi Jinping told his French counterpart Emmanuel Macron on Saturday that China will fulfill its obligations under the Paris climate change agreement, China's Foreign Ministry said in a statement....
World	https://www.nytimes.com/reuters/2017/07/08/world/asia/08reuters-g20-germany-trump-widodo.html	2017-07-08T10:09:30+0000	U.S. President Donald Trump said on Saturday the United States would do a lot of trade deals and business with Indonesia during a meeting with President Joko Widodo at the G20 gathering of the world's biggest economies....
World	https://www.nytimes.com/reuters/2017/07/08/world/europe/08reuters-g20-germany-trump-putin-meeting.html	2017-07-08T09:54:33+0000	Even U.S. First Lady Melania Trump was powerless to keep Friday's first face-to-face meeting of the U.S. and Russian presidents from running nearly twice as long as planned....
World	https://www.nytimes.com/reuters/2017/07/08/world/europe/08reuters-g20-germany-putin-flight.html	2017-07-08T09:54:32+0000	A plane carrying Russian President Vladimir Putin to the G20 summit in Germany made a detour of about 500 km (300 miles) to avoid flying over NATO members Poland or the Baltic states, data from a flight tracker showed....
World	https://www.nytimes.com/reuters/2017/07/08/world/europe/08reuters-g20-germany-trump-putin-talks.html	2017-07-08T09:54:29+0000	In a meeting that ran longer than either side had planned, U.S. President Donald Trump and Russia's Vladimir Putin discussed alleged Russian meddling in the U.S. election on Friday but agreed to focus on better ties rather than litigating the past...
World	https://www.nytimes.com/reuters/2017/07/08/world/europe/08reuters-g20-germany-putini-trump-election.html	2017-07-08T09:51:29+0000	Russian President Vladimir Putin told U.S. President Donald Trump on Friday that Moscow had not meddled in the U.S. elections, and Trump accepted it, Russian Foreign Minister Sergei Lavrov said....
Business Day	https://www.nytimes.com/reuters/2017/07/08/business/08reuters-gambia-economy.html	2017-07-08T09:45:29+0000	Chinese and French companies are bidding to help Gambia build up its Atlantic port Banjul to be what industry sources say could be a rival to neighbouring Senegal's Dakar....
World	https://www.nytimes.com/reuters/2017/07/08/world/europe/08reuters-g20-germany-ukraine-kremlin.html	2017-07-08T09:39:32+0000	Measures are needed that will lead to a genuine ceasefire in Ukraine, and implementation of the Minsk agreements to end the conflict there has been too slow, the Kremlin said on Saturday....
World	https://www.nytimes.com/reuters/2017/07/08/world/europe/08reuters-britain-fire.html	2017-07-08T09:39:28+0000	The firefighters who battled an inferno at a London apartment block that killed at least 80 people last month were hindered by equipment failings including the lack of a high ladder, the BBC reported on Saturday....
World	https://www.nytimes.com/reuters/2017/07/08/world/europe/08reuters-china-rights.html	2017-07-08T09:36:30+0000	The Chinese hospital treating Nobel Peace laureate Liu Xiaobo said on Saturday his cancer was in the final stages and while a German and a U.S. doctor who visited his bedside had approved of his treatment they had asked for him to be moved abroad....
World	https://www.nytimes.com/aponline/2017/07/08/world/europe/ap-eu-britain-stolen-engagement-ring.html	2017-07-08T09:33:40+0000	Police in Britain say a thief who robbed a 91-year-old woman of her jewelry and then used her wedding ring to make a marriage proposal has been jailed....
