section_name	web_url	pub_date	snippet
Business Day	https://www.nytimes.com/reuters/2017/07/10/business/10reuters-amazon-stocks.html	2017-07-10T23:45:29+0000	Amazon.com shares rose on Monday ahead of the world's largest online retailer's own version of Black Friday, while its new service to help set up 'smart homes' weighed on rival Best Buy Co Inc....
World	https://www.nytimes.com/reuters/2017/07/10/world/asia/10reuters-hawaii-security.html	2017-07-10T23:42:29+0000	A U.S. Army soldier who served in Iraq and Afghanistan and is now stationed in Hawaii has been arrested on charges of providing material support to Islamic State extremists, the Federal Bureau of Investigation said on Monday....
World	https://www.nytimes.com/aponline/2017/07/10/world/asia/ap-un-united-nations-myanmar-human-rights.html	2017-07-10T23:40:23+0000	U.S. Ambassador Nikki Haley is urging the international community "to stand together" and call on Myanmar's government to cooperate with a U.N. mission charged with probing alleged abuses by military and security forces, including against the mino...
Business Day	https://www.nytimes.com/reuters/2017/07/10/business/10reuters-ireland-economy-consumersentiment.html	2017-07-10T23:18:30+0000	Irish consumer sentiment surged to its highest level in 16 months in June, a survey showed on Tuesday....
Business Day	https://www.nytimes.com/reuters/2017/07/10/business/10reuters-usa-trump-fed.html	2017-07-10T23:18:29+0000	U.S. President Donald Trump plans to nominate former Treasury official Randal Quarles to be the Federal Reserve's top banking regulator, the White House said on Monday....
Business Day	https://www.nytimes.com/reuters/2017/07/10/business/10reuters-britain-economy-retail.html	2017-07-10T23:06:32+0000	British households spent more money on food and other essentials last month but held back on less urgent purchases as they faced rising prices, two sets of industry figures showed on Tuesday....
Business Day	https://www.nytimes.com/reuters/2017/07/10/business/10reuters-britain-eu-banks-outlook.html	2017-07-10T23:06:28+0000	Optimism about the business environment among Britain's financial services firms declined in the second quarter of this year, according to a survey published on Tuesday....
Business Day	https://www.nytimes.com/reuters/2017/07/10/business/10reuters-usa-m-a-fashion.html	2017-07-10T23:00:33+0000	Mergers and acquisitions for fashion retailers are like a crop top t-shirt: a risk best braved by a select few and avoided after a certain age....
World	https://www.nytimes.com/reuters/2017/07/10/world/europe/10reuters-usa-trump-russia-factbox.html	2017-07-10T23:00:30+0000	Alan Futerfas, the lawyer Donald Trump Jr. has hired to represent him in connection with Russia-related probes, has over 25 years experience in handling government investigations and criminal cases....
Business Day	https://www.nytimes.com/2017/07/10/business/dealbook/warren-buffett-elliott-management-energy-future-oncor.html	2017-07-10T22:37:58+0000	The hedge fund said it was working on a $9.3 billion takeover bid for Energy Future Holdings that would edge out a $9 billion offer by Berkshire Hathaway....
World	https://www.nytimes.com/reuters/2017/07/10/world/middleeast/10reuters-gulf-qatar-kuwait.html	2017-07-10T22:18:28+0000	The United States, United Kingdom and Kuwait urged all parties to a Gulf Arab diplomatic row over Qatar to resolve their dispute as quickly as possible through dialogue, Kuwait state news agency KUNA reported on Tuesday....
Business Day	https://www.nytimes.com/aponline/2017/07/10/business/ap-us-business-highlights.html	2017-07-10T22:12:58+0000	
World	https://www.nytimes.com/reuters/2017/07/10/world/middleeast/10reuters-gulf-qatar-documents.html	2017-07-10T22:09:30+0000	Four Arab states sought on Monday to pile pressure on Qatar over charges it backs terrorism, saying the publication of a previously secret accord between Riyadh and Doha showed Qatar broke a promise not to meddle in the affairs of Gulf countries....
Business Day	https://www.nytimes.com/reuters/2017/07/10/business/10reuters-buffett-charities.html	2017-07-10T22:06:32+0000	Warren Buffett on Monday donated roughly $3.17 billion of Berkshire Hathaway Inc stock to the Bill &amp; Melinda Gates Foundation and four family charities, his largest contribution in a more than decade-long plan to give away his fortune....
World	https://www.nytimes.com/reuters/2017/07/10/world/10reuters-slovenia-rights.html	2017-07-10T22:03:29+0000	Slovenia should speed up its asylum procedures and avoid implementing a new law that allows it to seal its borders to most illegal migrants, a senior human rights official said on Tuesday....
Business Day	https://www.nytimes.com/reuters/2017/07/10/business/10reuters-usa-crime-shkreli.html	2017-07-10T21:27:31+0000	An investor in Martin Shkreli's hedge fund testified on Monday that the former drug company executive, now on trial for securities fraud in federal court in New York, reminded him of Dustin Hoffman's autistic character in the movie "Rain Man."...
World	https://www.nytimes.com/aponline/2017/07/10/world/asia/ap-un-united-nations-north-korea.html	2017-07-10T21:22:02+0000	The United States has circulated a draft resolution that would impose new sanctions on North Korea following its first test of an intercontinental ballistic missile, two U.N. diplomats said Monday....
World	https://www.nytimes.com/aponline/2017/07/10/world/europe/ap-eu-poland-protest.html	2017-07-10T21:19:24+0000	Hundreds of government critics held a peaceful protest of the monthly observances Poland's ruling party holds in memory of President Lech Kaczynski and 95 others killed in a 2010 plane crash....
World	https://www.nytimes.com/2017/07/10/world/asia/hindu-pilgrims-kashmir-shooting.html	2017-07-10T21:08:51+0000	Unidentified militants opened fire on a bus traveling from a Himalayan shrine, and 16 others were wounded, three of them critically....
World	https://www.nytimes.com/reuters/2017/07/10/world/middleeast/10reuters-israel-politics-labour.html	2017-07-10T21:03:32+0000	Outsider Avi Gabbai was elected chairman of Israel's opposition Labour party on Monday by beating veteran Amir Peretz, a former defense minister and labor union chief, in a leadership runoff....
World	https://www.nytimes.com/reuters/2017/07/10/world/europe/10reuters-oshkosh-pentagon-britain.html	2017-07-10T20:48:28+0000	The U.S. State Department has approved the possible sale to Britain of Joint Light Tactical Vehicles and accessories with an estimated worth of $1.035 billion, the Pentagon said on Monday....
World	https://www.nytimes.com/reuters/2017/07/10/world/asia/10reuters-myanmar-usa-un.html	2017-07-10T20:45:31+0000	The United States on Monday called on Myanmar to allow a United Nations fact-finding mission to investigate widespread allegations of killings, rape and torture by security forces against Rohingya Muslims in Myanmar's Rakhine state....
Business Day	https://www.nytimes.com/reuters/2017/07/10/business/10reuters-brazil-economy.html	2017-07-10T20:39:31+0000	Brazil's government is not discussing changes to a new benchmark interest rate proposed for state development bank BNDES despite recent criticism by the bank's recently appointed president, Planning Minister Dyogo Oliveira told Reuters on Monday....
Business Day	https://www.nytimes.com/2017/07/10/business/hotels-employee-training-hospitality.html	2017-07-10T20:38:02+0000	Hospitality workers are finding that technology has its limits and are being encouraged to embrace their roles as ambassadors for their cities....
World	https://www.nytimes.com/2017/07/10/world/europe/hamburg-germany-g-20-protests.html	2017-07-10T20:35:23+0000	Protests during the Group of 20 summit exposed Germany’s difficulty in effectively guaranteeing the right to nonviolent expression while maintaining public order....
World	https://www.nytimes.com/aponline/2017/07/10/world/americas/ap-lt-brazil-political-crisis.html	2017-07-10T20:19:01+0000	A key Brazilian lawmaker argued Monday that President Michel Temer should be suspended from office and put on trial in the country's highest court on a corruption charge....
World	https://www.nytimes.com/reuters/2017/07/10/world/americas/10reuters-brazil-corruption.html	2017-07-10T20:18:31+0000	The rapporteur for a Brazilian lower house committee examining a corruption charge against President Michel Temer recommended on Monday that the body vote to put Temer on trial....
Business Day	https://www.nytimes.com/reuters/2017/07/10/business/10reuters-snap-stocks.html	2017-07-10T20:18:30+0000	Snap Inc shares slipped below their initial public offering price of $17 for the first time on Monday, signaling waning investor confidence in the social media company's growth potential as it faces fierce competition....
Business Day	https://www.nytimes.com/2017/07/10/business/dealbook/blackstone-group-leonard-green.html	2017-07-10T20:09:40+0000	The returns from the buyout business have been outshining stakes in hedge funds....
World	https://www.nytimes.com/reuters/2017/07/10/world/europe/10reuters-usa-trump-russia-intel.html	2017-07-10T20:09:35+0000	The U.S. Senate Intelligence Committee wants to speak with Donald Trump Jr., President Donald Trump's eldest son, about a meeting he held with a Russian lawyer during his father's  campaign, NBC News reported on Monday, citing a committee source....
World	https://www.nytimes.com/reuters/2017/07/10/world/americas/10reuters-venezuela-politics-ortega.html	2017-07-10T20:06:29+0000	From blocking off the office heliport to plotting protests, workers at Venezuela's prosecutor's office are making plans to fight her expected removal by allies of President Nicolas Maduro, according to three sources....
World	https://www.nytimes.com/reuters/2017/07/10/world/americas/10reuters-venezuela-politics.html	2017-07-10T20:00:32+0000	From blocking off the office heliport to plotting protests, workers at Venezuela's prosecutor's office are making plans to fight her expected removal by allies of President Nicolas Maduro, according to three sources....
Business Day	https://www.nytimes.com/reuters/2017/07/10/business/10reuters-twitter-abuse.html	2017-07-10T20:00:30+0000	Twitter Inc, in its latest step to curb abusive behavior on its platform, rolled out new features on Monday to help users disable notifications from accounts that they want to avoid....
World	https://www.nytimes.com/2017/07/10/world/asia/india-us-japan-war-games-china.html	2017-07-10T19:47:30+0000	The Indian Navy also announced a plan to station warships to monitor movement through the Strait of Malacca, where many Chinese vessels enter from the South China Sea....
Business Day	https://www.nytimes.com/2017/07/10/business/china-labor-ivanka-trump-shoes.html	2017-07-10T19:45:34+0000	The arrest of Hua Haifeng in May led to weeks in detention under poor conditions and multiple interrogations, and he now faces trial....
World	https://www.nytimes.com/reuters/2017/07/10/world/middleeast/10reuters-mideast-crisis-usa-islamicstate.html	2017-07-10T19:45:31+0000	With Islamic State all but ejected from one if its former capitals and surrounded in the other, members of a 72-nation coalition meet in Washington this week to try to ensure the  battlefield victories do not, once again, evaporate amid new sectar...
World	https://www.nytimes.com/2017/07/10/world/asia/india-vegetarian-airline-food-uproar.html	2017-07-10T19:39:46+0000	The state-run airline said it was saving money by no longer serving meat in coach on domestic flights, but critics saw it as discrimination against non-Hindus....
World	https://www.nytimes.com/reuters/2017/07/10/world/europe/10reuters-usa-trump-russia-meeting.html	2017-07-10T19:33:30+0000	There was nothing inappropriate about a meeting President Donald Trump's son had with a Russian attorney during the presidential campaign last year, the White House said on Monday, adding it was short and produced "absolutely no follow-up."...
World	https://www.nytimes.com/aponline/2017/07/10/world/americas/ap-lt-costa-rica-ariana-grande.html	2017-07-10T19:25:10+0000	Authorities in Costa Rica arrested a 22-year-old Colombian man suspected of threatening to stage an attack at a concert by pop singer Ariana Grande....
World	https://www.nytimes.com/reuters/2017/07/10/world/middleeast/10reuters-usa-alqaeda-plot.html	2017-07-10T19:24:34+0000	An Indian citizen pleaded guilty in a U.S. court on Monday to conspiring to aid an al Qaeda leader in Yemen and attempting to pay an undercover FBI agent $15,000 to murder a U.S. federal judge, authorities said....
World	https://www.nytimes.com/aponline/2017/07/10/world/asia/ap-as-rel-kashmir-pilgrims-attacked-the-latest.html	2017-07-10T19:22:12+0000	The Latest on suspected rebels opening fire on a passenger bus carrying Hindu pilgrims (all times local):...
World	https://www.nytimes.com/aponline/2017/07/10/world/americas/ap-lt-venezuela-political-crisis.html	2017-07-10T19:19:09+0000	Venezuela's chief prosecutor filed charges Monday against a senior National Guard commander over an attack on congress in which four lawmakers were beaten up by pro-government activists....
Business Day	https://www.nytimes.com/reuters/2017/07/10/business/10reuters-sweden-eu-banking-union.html	2017-07-10T19:12:30+0000	Sweden is looking at whether to join the European Union's banking union, local news agency TT reported on Monday, days after neighbouring Denmark said it would decide in 2019 whether would join....
Business Day	https://www.nytimes.com/reuters/2017/07/10/business/10reuters-eurozone-greece-regling.html	2017-07-10T19:09:29+0000	Greece should develop a strategy for its return to market borrowing and raise private finance before its euro zone bailout programme ends in a year's time, the head of the European Stability Mechanism said on Monday....
World	https://www.nytimes.com/aponline/2017/07/10/world/middleeast/ap-ml-israel-labor-.html	2017-07-10T19:01:08+0000	Israel's Labor party elected political newcomer Avi Gabbay as its leader Monday hoping to inject new blood into the movement that steered the country in the decades after independence but has been shut out of power for 16 years....
World	https://www.nytimes.com/aponline/2017/07/10/world/africa/ap-af-senegal-former-president.html	2017-07-10T19:01:06+0000	Hundreds of people filled the streets of Dakar outside the airport Monday to welcome former Senegal President Abdoulaye Wade, who returned to lead his party into legislative elections after spending years abroad following a failed bid for a third ...
Business Day	https://www.nytimes.com/reuters/2017/07/10/business/10reuters-britain-fairtrade-tea.html	2017-07-10T18:39:34+0000	British supermarket Waitrose said it is extending its commitment to using the Fairtrade logo on its teas, days after rival Sainsbury's faced criticism from shareholders for piloting a different scheme....
World	https://www.nytimes.com/2017/07/10/world/europe/uk-grenfell-fire-death-toll.html	2017-07-10T18:21:06+0000	The London police say that around 80 people died in the June 14 disaster, but several volunteer researchers believe the toll could be higher....
World	https://www.nytimes.com/aponline/2017/07/10/world/middleeast/ap-ml-israel-mideast-train.html	2017-07-10T18:18:57+0000	A senior Israeli Cabinet minister is pushing a plan to build a region-wide train network that he says could link Israel and the Palestinians to much of the Arab world....
World	https://www.nytimes.com/reuters/2017/07/10/world/europe/10reuters-usa-trump-russia.html	2017-07-10T18:15:30+0000	Donald Trump Jr. has hired a lawyer to represent him in Russia-related investigations, his office and the lawyer said on Monday, as Republicans voiced concern about a meeting between the U.S. president's son and a Russian....
World	https://www.nytimes.com/2017/07/10/world/middleeast/iraq-mosul-celebration.html	2017-07-10T18:12:50+0000	As the battle with the Islamic State in Mosul nears an end, other conflicts on the margins are flaring and a threat to the Iraqi state and society remains....
Business Day	https://www.nytimes.com/reuters/2017/07/10/business/10reuters-eu-google-lawyers.html	2017-07-10T18:12:36+0000	Google has ramped up its legal firepower as it prepares to do battle with EU antitrust regulators after a landmark 2.4-billion-euro ($2.7 billion) fine and the possibility of a second record sanction before the end of the year....
World	https://www.nytimes.com/reuters/2017/07/10/world/europe/10reuters-russia-venezuela.html	2017-07-10T18:12:28+0000	Russian President Vladimir Putin and his Venezuelan counterpart Nicolas Maduro discussed by telephone cooperation between the two countries, including implementation of projects in the energy sector, the Kremlin said in a statement on Monday....
World	https://www.nytimes.com/reuters/2017/07/10/world/europe/10reuters-cyprus-conflict-anastasiades.html	2017-07-10T18:09:30+0000	President of Cyprus Nicos Anastasiades said on Monday he remained ready to negotiate a peace deal with estranged Turkish Cypriots and Turkey, after U.N.-backed talks ended in acrimony last week....
World	https://www.nytimes.com/reuters/2017/07/10/world/middleeast/10reuters-bahrain-rights.html	2017-07-10T18:06:27+0000	A Bahrain court sentenced rights campaigner Nabeel Rajab to two years in jail on Monday, supporters said, for allegedly making &#8220;false or malicious&#8221; statements about Bahraini authorities....
Business Day	https://www.nytimes.com/reuters/2017/07/10/business/10reuters-emirates-angola.html	2017-07-10T18:03:45+0000	Emirates [EMIRA.UL] airline has scaled back its five weekly flights to the Angolan capital Luanda to three due to the difficulty of repatriating revenue earned in the country, the president of the Middle East's largest airline said....
Business Day	https://www.nytimes.com/reuters/2017/07/10/business/10reuters-ukraine-crisis-crimea-power-russia.html	2017-07-10T18:03:33+0000	Russian Energy Minister Alexander Novak said on Monday that construction of two power plants in Crimea would go ahead....
World	https://www.nytimes.com/aponline/2017/07/10/world/middleeast/ap-ml-iraq-mosul-war-by-the-numbers.html	2017-07-10T18:01:02+0000	Here are some statistics that illustrate the scope of the fight that wrested the northern Iraqi city of Mosul from the Islamic State group and the legacy of the wider war against the militants....
World	https://www.nytimes.com/aponline/2017/07/10/world/middleeast/ap-ml-islamic-state-news-guide.html	2017-07-10T18:00:59+0000	Iraq's announcement of victory in Mosul effectively shatters the Islamic State group's self-styled caliphate. But a complete territorial defeat will take many more months, and the extremists will likely pose a threat in Iraq, Syria and beyond for ...
World	https://www.nytimes.com/aponline/2017/07/10/world/europe/ap-eu-cyprus-peace-talks.html	2017-07-10T18:00:57+0000	Drilling off ethnically divided Cyprus in search of oil and gas will go ahead as scheduled following the collapse of reunification talks despite strong objections voiced by Turkey, the island's president said Monday....
Business Day	https://www.nytimes.com/2017/07/10/business/dealbook/class-action-lawsuits-finance-banks.html	2017-07-10T17:58:45+0000	The Consumer Financial Protection Bureau is adopting a rule that would block banks and credit card companies from forcing customers into arbitration....
Business Day	https://www.nytimes.com/aponline/2017/07/10/business/ap-us-wells-fargo-settlement.html	2017-07-10T17:57:56+0000	Wells Fargo has received preliminary approval to pay out $142 million to customers affected by the bank's sales practices scandal....
Business Day	https://www.nytimes.com/reuters/2017/07/10/business/10reuters-saudi-aramco-industry.html	2017-07-10T17:48:32+0000	Saudi Aramco received &lt;IPO-ARMO.SE&gt; the approval of the Saudi government to set up two new companies that will develop and operate a new Energy Industrial City in Saudi Arabia, as the kingdom seeks to expand its industrial base, state news a...
Business Day	https://www.nytimes.com/reuters/2017/07/10/business/10reuters-apache-investors.html	2017-07-10T17:48:29+0000	Apache Corp could be worth double its current stock price, some investors say, as strong management and sizeable assets have gotten a number of fund managers to place big bets on the Houston-based oil and gas producer, Barron's reported on Sunday....
World	https://www.nytimes.com/reuters/2017/07/10/world/middleeast/10reuters-mideast-crisis-iraq-usa.html	2017-07-10T17:42:31+0000	The U.S.-led coalition backing Iraqi forces against Islamic State on Monday warned that victory against the ultra-hardline group in Mosul did not mark the end of its global threat and urged Iraqis to unite to defeat the militants....
Business Day	https://www.nytimes.com/2017/07/10/business/dealbook/digital-privacy-supreme-court.html	2017-07-10T17:41:09+0000	Two cases — one involving cell site location and the other emails — may determine how digital information fits under Fourth Amendment protections....
World	https://www.nytimes.com/aponline/2017/07/10/world/middleeast/ap-ml-iraq-mosul-5-things-to-know.html	2017-07-10T17:39:56+0000	Iraq's prime minister declared victory over the Islamic State group in Mosul after more than eight months of some of the toughest fighting Iraqi forces have faced in the more than 3-year-old war against the extremists....
Business Day	https://www.nytimes.com/reuters/2017/07/10/business/10reuters-autos-honda.html	2017-07-10T17:36:32+0000	Honda Motor Co said on Monday it had confirmed an 11th U.S. death involving one of its vehicles tied to a faulty Takata Corp air bag inflator....
World	https://www.nytimes.com/aponline/2017/07/10/world/middleeast/ap-ml-mosul-timeline.html	2017-07-10T17:34:04+0000	A timeline of events in the rise and fall of the Islamic State group in Iraq and Mosul....
World	https://www.nytimes.com/aponline/2017/07/10/world/asia/ap-as-rel-kashmir-pilgrims-attacked.html	2017-07-10T17:30:56+0000	Gunmen sprayed bullets on a passenger bus bringing Hindu pilgrims back from a cave shrine in Indian-controlled Kashmir on Monday, killing at least seven of them, including five women, and wounding 14 others, police said....
World	https://www.nytimes.com/aponline/2017/07/10/world/europe/ap-eu-britain-sick-baby-glance.html	2017-07-10T17:25:11+0000	Charlie Gard is a terminally ill British child whose parents are fighting for the right to take him to the United States for an experimental treatment. His case has gained international attention, including from Pope Francis and U.S. President Don...
World	https://www.nytimes.com/reuters/2017/07/10/world/americas/10reuters-peru-ecuador.html	2017-07-10T17:18:29+0000	Peru has recalled its ambassador to Ecuador after Quito refused to stop building a wall along a canal separating the two, Peru's Foreign Affairs Ministry said on Monday as both countries expressed concern over flood risks....
Business Day	https://www.nytimes.com/reuters/2017/07/10/business/10reuters-fiatchrysler-emissions.html	2017-07-10T17:15:32+0000	A U.S. judge overseeing lawsuits against Fiat Chrysler Automobiles NV over its alleged excess diesel emissions said he intends to name well-known compensation expert Ken Feinberg to try to reach a settlement....
World	https://www.nytimes.com/2017/07/10/world/middleeast/syria-truce-jordan-golan-trump-russia-united-nations.html	2017-07-10T17:13:46+0000	The cease-fire, near the Syria border with Jordan and the Israeli-occupied Golan Heights, was holding 24 hours after it took effect Sunday....
World	https://www.nytimes.com/reuters/2017/07/10/world/asia/10reuters-northkorea-missile-un.html	2017-07-10T17:12:30+0000	United States Ambassador to the United Nations Nikki Haley aims to put to a vote within weeks a U.N. Security Council resolution to impose stronger sanctions on North Korea over its long-range ballistic missile test, said several senior U.N. diplo...
World	https://www.nytimes.com/reuters/2017/07/10/world/europe/10reuters-usa-baltics-patriot.html	2017-07-10T17:06:33+0000	The United States deployed a battery of Patriot long-range anti-aircraft missiles in Lithuania to be used in NATO wargames from Tuesday - the first time the advanced defense system has been brought to the Baltics where Russia has air superiority....
Business Day	https://www.nytimes.com/reuters/2017/07/10/business/10reuters-nissan-sales.html	2017-07-10T17:06:32+0000	Nissan Motor Co (7201.T) expects that zero-emission cars will make up to 20 percent of its sales in Europe by 2020, Gareth Dunsmore, Electric Vehicle (EV) Director for Nissan Europe said in a statement on Monday....
Business Day	https://www.nytimes.com/reuters/2017/07/10/business/10reuters-ryanair-ukraine.html	2017-07-10T17:03:35+0000	Irish low-cost airline Ryanair has canceled plans to start flying to Ukraine, saying on Monday that the main airport in Kiev had not honored terms agreed earlier this year....
Business Day	https://www.nytimes.com/2017/07/10/business/energy-environment/siemens-russia-crimea-turbines.html	2017-07-10T16:58:05+0000	The incident threatens to strain relations between the two countries and demonstrates how energy has become a weapon in Russia’s struggle with Ukraine....
World	https://www.nytimes.com/reuters/2017/07/10/world/europe/10reuters-nazi-art-madrid.html	2017-07-10T16:57:33+0000	A federal appeals court on Monday revived a lawsuit seeking to force a Madrid museum to return an Impressionist masterpiece to the family of a Jewish woman who was compelled to sell it to a Nazi art appraiser for $360 in 1939 so she could flee Ger...
World	https://www.nytimes.com/reuters/2017/07/10/world/asia/10reuters-india-kashmir.html	2017-07-10T16:57:30+0000	Six Hindu pilgrims, most of them women, were killed in a gunbattle that erupted in Indian Kashmir on Monday following two of militant attacks on police....
