section_name	web_url	pub_date	snippet
World	https://www.nytimes.com/aponline/2017/07/07/world/europe/ap-eu-turkey-opposition-march.html	2017-07-07T14:58:08+0000	The leader of Turkey's main opposition party said Friday he believes he has become the voice of thousands of people victimized by the government's large-scale crackdown on civil servants, journalists and critics following last year's failed coup a...
World	https://www.nytimes.com/aponline/2017/07/07/world/europe/ap-eu-turkey-netherlands.html	2017-07-07T14:58:04+0000	Turkey's deputy prime minister has accused the Netherlands of infringing on the rights of Turkish citizens after Dutch authorities said he was not welcome to deliver a speech there....
World	https://www.nytimes.com/reuters/2017/07/07/world/europe/07reuters-usa-ukraine-volker-poroshenko.html	2017-07-07T14:54:30+0000	Ukrainian President Petro Poroshenko on Friday welcomed the appointment of Kurt Volker to serve as Washington's special representative to Ukraine, saying it would help end what he called Russian aggression and restore Crimea to Ukraine....
World	https://www.nytimes.com/aponline/2017/07/07/world/europe/ap-eu-lithuania-espionage.html	2017-07-07T14:49:16+0000	A court in Lithuania has found a Russian national guilty of spying and sentenced him to 10 years in prison for attempting to recruit local officials to plant listening devices at the offices of the Baltic nation's president....
World	https://www.nytimes.com/aponline/2017/07/07/world/europe/ap-eu-greece-pm-hospitalized.html	2017-07-07T14:49:15+0000	A Greek official says Prime Minister Alexis Tsipras has successfully undergone a hernia operation and will leave an Athens hospital Saturday morning,...
World	https://www.nytimes.com/reuters/2017/07/07/world/europe/07reuters-g20-germany-trump-putin-talks.html	2017-07-07T14:39:32+0000	In a meeting that ran longer than either side had planned, U.S. President Donald Trump and Russia's Vladimir Putin discussed alleged Russian meddling in the U.S. election on Friday but agreed to focus on better ties rather than litigating the past...
World	https://www.nytimes.com/reuters/2017/07/07/world/europe/07reuters-g20-germany-trump-putin-meeting.html	2017-07-07T14:39:29+0000	Even U.S. First Lady Melania Trump was powerless to keep Friday's first face-to-face meeting of the U.S. and Russian presidents from running nearly twice as long as planned....
World	https://www.nytimes.com/reuters/2017/07/07/world/asia/07reuters-g20-northkorea.html	2017-07-07T14:36:34+0000	U.S. Secretary of State Rex Tillerson said on Friday there would not be many good options left on North Korea if the peaceful pressure campaign the United States has been pushing to curb Pyongyang's nuclear and missile programs failed....
World	https://www.nytimes.com/aponline/2017/07/07/world/europe/ap-eu-britain-eli-lilly-lawsuit.html	2017-07-07T14:34:24+0000	Britain's Supreme Court has ruled in favor of Eli Lilly and Co. in a patent dispute with generic drug-maker Actavis over Lilly's Alimta cancer treatment....
World	https://www.nytimes.com/2017/07/07/world/europe/russia-navalny-released.html	2017-07-07T14:21:13+0000	The anticorruption crusader was released from prison a day after the authorities raided his offices nationwide to thwart a protest rally....
Business Day	https://www.nytimes.com/reuters/2017/07/07/business/07reuters-markets-bonds-funds.html	2017-07-07T14:15:31+0000	Shifting market perceptions about central bank policy suggest world bond markets are at a tipping point and the rise in yields over the past week could have further to go, investment managers said on Friday....
Business Day	https://www.nytimes.com/column/the-shift	2017-07-07T14:13:44+0000	None
World	https://www.nytimes.com/aponline/2017/07/07/world/europe/ap-eu-greece-bailout.html	2017-07-07T14:10:20+0000	Europe's bailout fund has approved the payment of 8.5 billion euros ($9.6 billion) in rescue loans to Greece, a long-delayed installment under the country's third international bailout....
World	https://www.nytimes.com/reuters/2017/07/07/world/americas/07reuters-venezuela-politics.html	2017-07-07T14:09:33+0000	With many Venezuelans angry at the government and planning to sit out a July 30 vote for a new superbody assembly, President Nicolas Maduro has ordered all state workers to take part, seeking to avoid an embarrassingly low turnout....
World	https://www.nytimes.com/aponline/2017/07/07/world/europe/ap-us-trump-mexico.html	2017-07-07T14:07:29+0000	Better late than never: President Donald Trump and Mexico's President Enrique Pena Nieto sat down Friday for their first face-to-face meeting since Trump took office with plans for a border wall still looming and Trump asserting that he'll "absolu...
Business Day	https://www.nytimes.com/reuters/2017/07/07/business/07reuters-germany-economy-imf.html	2017-07-07T14:06:33+0000	The International Monetary Fund on Friday raised its growth forecast for Germany, citing soaring domestic demand and rebounding exports, and it repeated its call for Berlin to increase investment and reduce its current account surplus....
World	https://www.nytimes.com/reuters/2017/07/07/world/europe/07reuters-g20-germany-putin-southkorea.html	2017-07-07T14:03:33+0000	South Korea's President Moon Jae-in said he was in favor of dialogue with North Korea despite the "nuclear provocation" of its test-launch earlier this week of what the isolated state said was a nuclear-capable intercontinental missile....
Business Day	https://www.nytimes.com/reuters/2017/07/07/business/07reuters-venezuela-economy.html	2017-07-07T14:03:29+0000	Inflation in Venezuela's crisis-hit economy was 176 percent in the first half of 2017, the opposition-led congress said on Friday in the absence of official data....
Business Day	https://www.nytimes.com/interactive/2017/07/07/business/dealbook/document-contracts-for-deed-survey.html	2017-07-07T14:00:35+0000	The Uniform Law Commission conducted a survey that “found problems or abuses with contract for deed in 80 percent of the states.”...
World	https://www.nytimes.com/aponline/2017/07/07/world/middleeast/ap-ml-egypt-the-latest.html	2017-07-07T13:58:22+0000	The Latest on the situation in Egypt and the deadly militant attack in the Sinai Peninsula (all times local):...
World	https://www.nytimes.com/aponline/2017/07/07/world/americas/ap-lt-mexico-us-john-kelly.html	2017-07-07T13:55:07+0000	U.S. Homeland Security Secretary John Kelly said Friday that he told his Mexican counterpart the United States' demand for drugs was responsible for much of the violence on both sides of the border....
Business Day	https://www.nytimes.com/reuters/2017/07/07/business/07reuters-kind-llc-m-a.html	2017-07-07T13:54:27+0000	Kind LLC has hired investment banks to advise on a minority stake sale it hopes will value the maker of the eponymous snack bars at more than $3 billion (2.33 billion pounds), including debt, according to people familiar with the matter....
World	https://www.nytimes.com/2017/07/07/world/europe/uk-charlie-gard-us-doctor.html	2017-07-07T13:51:13+0000	In a U-turn, Great Ormond Street Hospital said it would ask a court to consider new claims about a potential treatment for Charlie Gard....
World	https://www.nytimes.com/aponline/2017/07/07/world/europe/ap-eu-britain-construction-deaths.html	2017-07-07T13:49:25+0000	A company director in Britain has been sentenced to 14 months in jail in the deaths of two construction workers....
Business Day	https://www.nytimes.com/reuters/2017/07/07/business/07reuters-eurozone-greece-esm.html	2017-07-07T13:48:30+0000	The European Stability Mechanism approved the release of a third tranche of bailout funds to Greece worth 8.5 billion euros (7.51 billion pounds) on Friday, the ESM said in a statement....
World	https://www.nytimes.com/reuters/2017/07/07/world/europe/07reuters-usa-healthcare-cdc.html	2017-07-07T13:45:32+0000	The Trump administration on Friday named Georgia public health Commissioner Dr Brenda Fitzgerald to lead the U.S. Centers for Disease Control and Prevention in Atlanta....
Business Day	https://www.nytimes.com/reuters/2017/07/07/business/07reuters-britain-eu-trade.html	2017-07-07T13:45:32+0000	British Trade Minister Liam Fox said on Friday there were no obstacles to replicating the current smooth trading agreements between Britain and the EU after Brexit, unless "politics got in the way of good economics"....
World	https://www.nytimes.com/reuters/2017/07/07/world/europe/07reuters-g20-germany-china.html	2017-07-07T13:42:35+0000	Chinese President Xi Jinping on Friday called on members of the Group of 20 (G20) nations to champion an open world economy, strengthen macroeconomic policy coordination and forestall risks in financial markets, state news agency Xinhua reported....
Business Day	https://www.nytimes.com/reuters/2017/07/07/business/07reuters-opec-oil.html	2017-07-07T13:42:29+0000	OPEC delegates said on Friday they were encouraged by Russia's openness to talking about changes to an OPEC-led deal to cut oil supplies, opening the door to more steps being considered to clear a global supply glut....
Business Day	https://www.nytimes.com/2017/07/07/business/samsung-profit-earnings.html	2017-07-07T13:40:02+0000	The South Korean giant has been dogged by crises including a smartphone recall and the corruption trial of its heir apparent....
World	https://www.nytimes.com/reuters/2017/07/07/world/middleeast/07reuters-mideast-crisis-usa-strikes.html	2017-07-07T13:36:34+0000	At least 600 civilians have been killed in strikes in Iraq and Syria by the U.S.-led coalition fighting Islamic State since the campaign began in 2014, according to a report released by the coalition on Friday....
Business Day	https://www.nytimes.com/reuters/2017/07/07/business/07reuters-whole-foods-m-a-amazon-com.html	2017-07-07T13:36:31+0000	Amazon.com Inc told Whole Foods Market Inc it would not engage in a sale process for the U.S. grocer that involved other bidders, a regulatory filing showed on Friday, shedding new light on the $13.7 billion acquisition....
World	https://www.nytimes.com/aponline/2017/07/07/world/europe/ap-eu-norway-rock-vandalized.html	2017-07-07T13:34:29+0000	A penis-shaped rock formation in southern Norway is up again after the popular tourist attraction was found badly damaged last month....
World	https://www.nytimes.com/reuters/2017/07/07/world/europe/07reuters-turkey-politics-opposition.html	2017-07-07T13:33:36+0000	Turkey's main opposition leader said on Friday his three-week "justice march" from Ankara to Istanbul had helped Turks "cast off a shirt of fear" under emergency rule, and vowed to stiffen his party's challenge to the government once the protest e...
World	https://www.nytimes.com/reuters/2017/07/07/world/asia/07reuters-japan-quake.html	2017-07-07T13:33:33+0000	An earthquake with a magnitude of 5.1 struck 33 miles offshore and south-southeast of the city of Sendai in Japan at 8:48 a.m. EDT (1248 GMT) on Friday, the U.S. Geological Survey said....
World	https://www.nytimes.com/reuters/2017/07/07/world/americas/07reuters-g20-germany-trump-mexico.html	2017-07-07T13:27:30+0000	U.S. President Donald Trump hailed progress on trade after meeting his Mexican counterpart on Friday, as Mexico's government said it expected a general agreement on reworking the North America Free Trade Agreement (NAFTA) by the end of 2017....
Business Day	https://www.nytimes.com/reuters/2017/07/07/business/07reuters-france-politics-assets.html	2017-07-07T13:24:32+0000	France will sell 10 billion euros (8.84 billion pounds) worth of state assets to finance projects geared towards innovation, a finance ministry source said on Friday....
World	https://www.nytimes.com/reuters/2017/07/07/world/middleeast/07reuters-israel-palestinians-hebron.html	2017-07-07T13:21:34+0000	The U.N. cultural organization declared an ancient shrine in the occupied West Bank a Palestinian heritage site on Friday, prompting Israel to further cut its funding to the United Nations....
World	https://www.nytimes.com/reuters/2017/07/07/world/asia/07reuters-asia-refugees.html	2017-07-07T13:21:30+0000	The head of the U.N. refugee agency urged Myanmar on Friday to grant citizenship to the Rohingya, a stateless Muslim minority in the Asian country where sectarian violence has displaced tens of thousands since 2012....
World	https://www.nytimes.com/aponline/2017/07/07/world/europe/ap-eu-volkswagen.html	2017-07-07T13:18:56+0000	German prosecutors said Friday they have arrested a former employee of the Volkswagen unit Audi in connection with the company's diesel scandal....
World	https://www.nytimes.com/aponline/2017/07/07/world/asia/ap-as-philippines-duterte.html	2017-07-07T13:18:41+0000	President Rodrigo Duterte said Friday he will likely extend 60 days of martial law he imposed in the southern Philippines to deal with a deadly siege of a city by militants allied with the Islamic State group because the situation remains critical...
World	https://www.nytimes.com/aponline/2017/07/07/world/europe/ap-eu-greece-us-tourist-beaten.html	2017-07-07T13:16:00+0000	Greek police say a 22-year-old American tourist has been fatally injured in a fight at a bar on the island of Zakinthos....
World	https://www.nytimes.com/aponline/2017/07/07/world/europe/ap-eu-cyprus-peace-talks-whats-next.html	2017-07-07T13:09:54+0000	Even the most hard-boiled Cypriots expressed pangs of disappointment Friday after the collapse of the latest round of talks aimed at reunifying their ethnically split island nation....
World	https://www.nytimes.com/aponline/2017/07/07/world/middleeast/ap-ml-egypt-civilians-killed.html	2017-07-07T13:01:34+0000	Three Egyptians who worked at a building site in the Western Desert were killed by an airstrike from a military aircraft in what appears to have been an accident, their family members said Friday....
World	https://www.nytimes.com/reuters/2017/07/07/world/asia/07reuters-asia-storm-japan.html	2017-07-07T13:00:30+0000	Thousands of Japanese rescuers searched on Friday for victims of freak rains that have killed at least 11 people and left hundreds cut off from the outside world by landslides....
Business Day	https://www.nytimes.com/2017/07/07/business/when-co-worker-behavior-seems-discriminatory.html	2017-07-07T13:00:24+0000	You sense workplace discrimination. Here’s what to do about it....
Business Day	https://www.nytimes.com/reuters/2017/07/07/business/07reuters-usa-economy-instant-view.html	2017-07-07T12:57:40+0000	U.S. job growth surged more than expected in June and employers increased hours for workers, signs of labor market strength that could keep the Federal Reserve on course for a third interest rate increase this year despite benign inflation....
Business Day	https://www.nytimes.com/reuters/2017/07/07/business/07reuters-lilly-allergan-alimta.html	2017-07-07T12:57:34+0000	Eli Lilly and Co won a years-long patent dispute with Actavis on Friday after the UK Supreme Court ruled that the generic drugmaker's versions of Lilly's top-selling cancer drug Alimta directly infringe on certain Lilly patents in Britain, France,...
Business Day	https://www.nytimes.com/aponline/2017/07/07/business/ap-us-buffett-oncor.html	2017-07-07T12:45:49+0000	Warren Buffett's Berkshire Hathaway is buying the Texas power transmitter Oncor for $9 billion, one of his biggest acquisitions....
Business Day	https://www.nytimes.com/reuters/2017/07/07/business/07reuters-usa-fed-futures.html	2017-07-07T12:45:33+0000	U.S. short-term interest rate futures reflected continued bets on the Federal Reserve next raising interest rates in December after a U.S. government report showed employers added more jobs than expected in June but delivered only gradual wage inc...
Business Day	https://www.nytimes.com/reuters/2017/07/07/business/07reuters-britain-deliveroo.html	2017-07-07T12:42:30+0000	British takeaway food delivery firm Deliveroo would give its self-employed riders insurance and sick pay if the government changed the law so it could offer some rather than all the entitlements enjoyed by workers, it said on Friday....
World	https://www.nytimes.com/reuters/2017/07/07/world/europe/07reuters-spain-taxation-messi.html	2017-07-07T12:39:34+0000	A Spanish court said on Friday it has exchanged a 21-month prison sentence handed to Soccer player Lionel Messi for tax fraud last July for a quarter-of-a-million-euro fine....
World	https://www.nytimes.com/reuters/2017/07/07/world/americas/07reuters-mexico-archaeology-aztecs.html	2017-07-07T12:39:32+0000	A sacrificial wolf elaborately&#160;adorned with some of the finest Aztec gold ever found and buried more than five centuries ago has come to light in the heart of downtown Mexico City, once home to the Aztec empire's holiest shrines....
Business Day	https://www.nytimes.com/reuters/2017/07/07/business/07reuters-britain-economy-niesr.html	2017-07-07T12:33:29+0000	British economic growth barely improved during the second quarter after a slow start to the year, the National Institute of Economic and Social Research said on Friday, after a disappointing batch of official data....
World	https://www.nytimes.com/aponline/2017/07/07/world/asia/ap-as-pakistan.html	2017-07-07T12:30:45+0000	Pakistan's foreign ministry has praised the United Nations for imposing sanctions on a splinter group of the Pakistani Taliban, which is linked to deadly attacks in the country....
World	https://www.nytimes.com/reuters/2017/07/07/world/americas/07reuters-mexico-archaeology-aztecs-exclusive.html	2017-07-07T12:27:30+0000	A sacrificial wolf elaborately&#160;adorned with some of the finest Aztec gold ever found and buried more than five centuries ago has come to light in the heart of downtown Mexico City, once home to the Aztec empire's holiest shrines....
World	https://www.nytimes.com/reuters/2017/07/07/world/07reuters-southsudan-budget.html	2017-07-07T12:24:31+0000	War-ravaged South Sudan needs donors to fund more than a third of its next budget, the finance minister said, but countries are reluctant due to corruption and conflict....
World	https://www.nytimes.com/2017/07/07/world/asia/north-korea-weapons.html	2017-07-07T12:19:52+0000	The best that Washington can do, analysts say, is freeze the program in place....
Business Day	https://www.nytimes.com/2017/07/07/business/dealbook/warren-buffett-energy-future-oncor.html	2017-07-07T12:13:27+0000	The deal would augment Berkshire Hathaway Energy, whose collection of utilities delivers power to 11.6 million customers across the West and Midwest....
World	https://www.nytimes.com/aponline/2017/07/07/world/europe/ap-eu-russia-opposition.html	2017-07-07T12:09:51+0000	Russian opposition leader Alexei Navalny was released from jail Friday after serving 25 days for organizing a wave of protests....
World	https://www.nytimes.com/aponline/2017/07/07/world/europe/ap-eu-trump-putin-30-minutes.html	2017-07-07T12:00:43+0000	So many issues, so little time. Donald Trump and Vladimir Putin have a scheduled half-hour meeting in Hamburg on Friday and a world of weighty topics to discuss, from the war in Syria to North Korea's saber-rattling to Moscow's alleged influence i...
Business Day	https://www.nytimes.com/reuters/2017/07/07/business/07reuters-usa-autos-auction.html	2017-07-07T12:00:30+0000	Two lanes apart at a noisy, fast-paced auto auction near Detroit, two vehicles show why major U.S. automakers have a problem with used cars....
World	https://www.nytimes.com/interactive/2017/07/07/world/europe/uk-buildings-fire-grenfell.html	2017-07-07T12:00:22+0000	Over 100 buildings in Britain have failed fire tests undertaken after the Grenfell Tower fire....
Business Day	https://www.nytimes.com/reuters/2017/07/07/business/07reuters-ecb-banks-ethics.html	2017-07-07T11:54:30+0000	The European Union's ethics watchdog is quizzing the President of the European Central Bank, Mario Draghi, over his and the ECB's involvement in an exclusive forum with bankers and fund managers....
World	https://www.nytimes.com/aponline/2017/07/07/world/asia/ap-as-thailand-ivory-trade.html	2017-07-07T11:51:47+0000	Efforts by Thailand's government to curb sales of ivory have been successful following criticism of widespread trafficking in the country, police and conservationists said....
World	https://www.nytimes.com/reuters/2017/07/07/world/asia/07reuters-vietnam-dissident.html	2017-07-07T11:51:28+0000	Vietnamese police have arrested a blogger for posting anti-state material on the internet, his mother said on Friday, as part of a crackdown on critics of the country's Communist rulers....
World	https://www.nytimes.com/reuters/2017/07/07/world/europe/07reuters-cyprus-conflict-turkey-test.html	2017-07-07T11:45:37+0000	Turkey will do everything within the framework of international law to defend the rights of Turkish Cypriots, Prime Minister Binali Yildirim said on Friday, as a reunification deal on ethnically split Cyprus collapsed....
World	https://www.nytimes.com/reuters/2017/07/07/world/europe/07reuters-cyprus-conflict-turkey.html	2017-07-07T11:45:34+0000	Turkey will do everything within the framework of international law to defend the rights of Turkish Cypriots, Prime Minister Binali Yildirim said on Friday, as a reunification deal on ethnically split Cyprus collapsed....
World	https://www.nytimes.com/aponline/2017/07/07/world/middleeast/ap-ml-qatar-the-latest.html	2017-07-07T11:43:00+0000	The Latest on Qatar developments (all times local):...
Business Day	https://www.nytimes.com/reuters/2017/07/07/business/07reuters-usa-stocks.html	2017-07-07T11:36:41+0000	Wall Street stocks closed on a high note Friday, with the S&amp;P 500 index posting its best gain in six sessions on the heels of a U.S. payrolls report that gave investors more confidence in the strength of the U.S. economy....
World	https://www.nytimes.com/reuters/2017/07/07/world/europe/07reuters-italy-housecollapse.html	2017-07-07T11:36:29+0000	Part of a four-storey apartment block near the Italian port city of Naples collapsed on Friday, leaving eight people missing, rescue workers said....
World	https://www.nytimes.com/reuters/2017/07/07/world/europe/07reuters-sweden-attacks-verdict.html	2017-07-07T11:30:34+0000	Three men with ties to the Swedish neo-Nazi movement were sentenced on Friday to up to eight and a half years in prison for bomb attacks in western Sweden over the past year....
World	https://www.nytimes.com/aponline/2017/07/07/world/africa/ap-af-zambia-political-tensions.html	2017-07-07T11:18:52+0000	These are edgy times in Zambia, once considered one of Africa's most stable democracies....
Business Day	https://www.nytimes.com/reuters/2017/07/07/business/07reuters-china-economy-policy.html	2017-07-07T11:18:37+0000	China's economy will maintain steady and improving momentum in the second half of this year, but it still faces many difficulties, state radio quoted Premier Li Keqiang as saying on Friday....
Business Day	https://www.nytimes.com/reuters/2017/07/07/business/07reuters-volkswagen-autonomous-kuka.html	2017-07-07T11:18:33+0000	German carmaker Volkswagen and robot maker Kuka are expanding a cooperation to develop ways that robots can help drivers of electric and autonomous vehicles, Volkswagen said in a statement on Friday....
World	https://www.nytimes.com/reuters/2017/07/07/world/europe/07reuters-g20-germany-blackbloc.html	2017-07-07T11:15:33+0000	For the 1,000 hard-left militants who wreaked havoc on the streets of Hamburg, German Chancellor Angela Merkel could not have chosen a better location to hold the G20 summit....
World	https://www.nytimes.com/aponline/2017/07/07/world/middleeast/ap-ml-iraq-the-latest.html	2017-07-07T11:12:58+0000	The Latest on developments in Iraq:...
World	https://www.nytimes.com/reuters/2017/07/07/world/europe/07reuters-russia-politics-navalny-release.html	2017-07-07T11:06:28+0000	Kremlin critic Alexei Navalny was released from a Moscow prison on Friday, his spokeswoman said, after completing a 25-day sentence for repeatedly violating the law on organizing public meetings....
World	https://www.nytimes.com/aponline/2017/07/07/world/europe/ap-ten-wimbledon-the-latest.html	2017-07-07T11:03:58+0000	The Latest from Wimbledon (all times local):...
World	https://www.nytimes.com/reuters/2017/07/07/world/europe/07reuters-usa-ukraine-volker.html	2017-07-07T11:03:29+0000	U.S. Secretary of State Rex Tillerson said on Friday he had chosen an envoy to lead U.S. diplomacy on the Ukraine crisis, adding that he had moved to fill the position at the urging of Russia's leader....
World	https://www.nytimes.com/reuters/2017/07/07/world/asia/07reuters-hongkong-ivory.html	2017-07-07T11:00:30+0000	Authorities in Hong Kong this week made their largest haul of contraband ivory in more than 30 years, amid surging illegal wildlife seizures fuelled by lax regulations and buoyant demand from mainland China....
Business Day	https://www.nytimes.com/2017/07/07/business/don-mal-vena-solutions-on-pursuit-of-making-your-numbers.html	2017-07-07T11:00:14+0000	The chief executive of Vena Solutions, a software firm, says he asks job candidates about sacrifices they would be willing to make to meet their goals....
World	https://www.nytimes.com/2017/07/07/world/asia/hong-kong-joshua-wong-censorship.html	2017-07-07T10:55:10+0000	The group, based in New York, said a decision to keep the democracy campaigner Joshua Wong from speaking at a Hong Kong book event was an “error in judgment.”...
World	https://www.nytimes.com/aponline/2017/07/07/world/europe/ap-eu-germany-g20-protests.html	2017-07-07T10:54:56+0000	Anti-globalization activists clashed violently with police across the German port city of Hamburg all day Friday, setting cars ablaze, throwing bottles and trying to enter the convention center where Group of 20 leaders tackled topics like interna...
